request,SearchScreeningEvent
What animated movies are playing at the closest movie theatre,1
find close by movies movie times,1
I need movie schedules,1
Show me when and where I can see Song of Summer,1
I'd like to watch movies at the closest movie theatre,1
When is Man in Outer Space playing at Megaplex Theatres,1
find a movie schedule,1
find A Feather in Her Hat at Magic Johnson Theatres,1
what is the movie schedules for animated movies nearby,1
What animated movies are there nearby?,1
"Show me the nearest movies at movie theatre for twenty one o'clock
",1
i want to watch Ghosts of the Abyss at Kerasotes Theatres,1
Find the movie schedule.,1
CAn I get the the showtimes for The Jade Faced Assassin cinema?,1
What time is The Christmas Toy playing at Loews Cineplex,1
I want to see the movie schedules for animated movies around here.,1
what kind of films are at the closest movie house,1
What are the movie times at Goodrich Quality Theaters?,1
where is The Cycle playing,1
What movie times are there for 5 p.m.?,1
Where is the nearest cinema playing Rainbow Eyes that starts in one minute?,1
Is Thenaruvi playing at the Douglas Theatre Company in one hour?,1
Find movie schedule for animated movies in the area,1
Show me the movie schedules for any animated movies playing close by?,1
show movies at the nearest movie house,1
I'm wondering if I can watch Heyy Babyy at a cinema.,1
List movies by movie times in the neighbourhood,1
movie schedule at Speakeasy Theaters,1
What movies are playing nearby?,1
find the closest cinema with animated movies,1
What animated movies are playing at the nearest movie theatre?,1
Provide me the movie schedules,1
I'd like to watch movies at Amco Entertainment,1
"find National Amusements with Honey, I Shrunk the Kids",1
I need movie times in the area for any type of movies,1
Where is the nearest movie theatre I can go watch films today?,1
What animated movies are playing AMC Theaters,1
What time is Three Cuckoo Clocks playing?,1
Show movie times at Kerasotes Theatres,1
"What time is Balkan Rhapsodies: 78 Measures of War playing at Malco Theatres?
",1
When is Robotix playing?,1
show me the schedule of movie The Duchess of Langeais in cinema,1
Find the movie schedules for Speakeasy Theaters.,1
Show me movie times at the Pacific Theatres for the movie The Hot Rock,1
whats the nearest movie house showing animated movies,1
find movies nearest to a movie house,1
Is Warhead playing at AMC Theaters,1
Is Judgment Day: The John List Story playing at Megaplex Theatres?,1
What time is Too Young to Marry showing,1
When is The Jailbird showing at United Paramount Theatres,1
Are there any animated movies playing at the Mann Theatres?,1
What time is the nearest cinema playing The Hopes of Blind Alley,1
Can I get the movie times for films in the neighborhood?,1
What movie theatre has A Matter of Wife... And Death,1
what time is The Graduate showing at Caribbean Cinemas,1
"What is the movie schedule at Caribbean Cinemas
",1
Find the schedule for films at night at Great Escape Theatres.,1
Showtimes for the Alamo Drafthouse Cinema for todays movies.,1
"what are the movie schedules for Great Escape Theatres
",1
find meal time movie times close by for movies,1
I'd like to watch The Freckled Fish at 00:47:43 at Magic Johnson Theatres,1
i need movie times for movies in the area,1
Give me the showtimes for animated movies at the nearest cinema.,1
Give me movie times,1
find Shanghaï Express,1
Find time for the movie schedule ,1
"Where is the closest movie theatre playing Yo, robot",1
When is Stripped to Kill II: Live Girls playing at the nearest movie house?,1
what movies are showing nearby,1
Which films are playing at Malco Theatres?,1
Find the movie schedules,1
find The Watcher at United Paramount Theatres,1
When is Percy Jackson playing at the movie theatre?,1
what time is Utamaro and His Five Women showing at Alamo Drafthouse Cinema,1
Find the schedule for the closest films at a cinema at meal time.,1
What movie times are at Bow Tie Cinemas?,1
I'd like to see a movies  at the nearest movie house,1
Which films are playing at the closest cinema?,1
What is the movie schedule in five minutes for movies playing in the neighborhood ,1
I want the nearest movie house with The Debtors,1
List the movie schedule for Regal Entertainment Group theater.,1
Find the schedule for animated movies in the neighborhood.,1
"Where is the closest cinema playing A Drink in the Passage
",1
Where is The Wilderness Trail playing,1
find a movie theatre with Life and Death,1
Can you provide me with movie schedules for Century Theatres?,1
What time does The Maze start at Cineplex Odeon Corporation,1
Please find the movie schedule for animated movies playing in the neighbourhood ,1
when is Our Story showing next at North American Cinemas,1
What time is The Graduates of Malibu High playing at Cobb Theatres,1
Fine a movie schedule.,1
Can i get todays showtimes for Le Flic de Beverly Hills 2?,1
Can I get The Marine 2 showtimes.,1
Where is Mother and Child plkaying,1
Is You Will Meet a Tall Dark Stranger at Bow Tie Cinemas,1
What time is Sundown: The Vampire in Retreat showing,1
"What animated movies are playing at KB Theatres
",1
What movie schedule are in the area for animated movies,1
show movie schedules for Fox Theatres,1
what animated movies are showing in the area ,1
i want to see some movies in a B&B Theatres,1
What are the movie times at the Malco Theatres?,1
What films are showing in the neighbourhood?,1
find movie schedules for Loews Cineplex,1
Show me the nearest movie house showing The Luckiest Girl in the World,1
What time is The Cobbler playing  at the closest movie theatre?,1
can i have the movie schedule for IMAX Corporation,1
what are the movie times for United Paramount Theatres,1
Find the schedule for Better This World at a movie house.,1
give me the movie schedule at Santikos Theatres,1
Find movie times.,1
Can I get the movie schedule for 8 a.m.?,1
What films are showing in the area?,1
What time is The Daring Dobermans playing,1
I'm looking for a movie schedule at the Cooper Foundation.,1
What is the closest movie house  playing films,1
what is the nearest movie house showing animated movies,1
What is the movie schedule for films that are playing nearby in 15 minutes,1
What movies are currently at Star Theatres?,1
when can iw atch Great Balls of Fire! - Vampate di fuoco,1
Find the schedule for Metallica Through the Never.,1
what animated movies are at the nearest cinema,1
movie times at Warren Theatres,1
I need a schedule for the cinema that is showing The Shiralee,1
When can I see Journey to the End of the Night?,1
show movie schedules,1
What time is The Taking of Pelham 1 2 3 playing at the movie theatre,1
What time is The Burning Season playing,1
Is Love Coach playing at Speakeasy Theaters?,1
Find the schedule for Kingsman: The Secret Service at a movie theatre.,1
What time is Always Brando showing,1
Show the movie schedule,1
What's on the movie schedules at Amco Entertainment?,1
I'm wondering when I can see Beating Heart at the nearest cinema.,1
Check films screened at the closest cinema,1
I want to know the animated movies playing at Malco Theatres,1
what time is The Dungeonmaster playing at AMC Theaters,1
Is Lord Jim at the movie house,1
I want a list of showings of Days of Fire at Harkins Theatres,1
"I'm looking for movie times, search movies close by that start at 11:12.",1
What time is the Wanda Group playing The Honor of an Outlaw,1
show movie times for animated movies nearby,1
fimd films around here,1
What local movie house is playing Beat the Drum,1
What film is playing at Landmark Theatres,1
Find the movie schedule for animated movies in the neighborhood.,1
What movie times are Harkins Theatres,1
FInd the movie schedule for nearby movies.,1
Find the schedule for Tube at the closest movie theatre.,1
Show me the movie times for animated movies that are in theaters close by,1
find a brunch time cinema nearest with The President Is Coming,1
When is Purple Heart scheduled at the nearest movie house?,1
What animated movies are playing now in the neighborhood ,1
When will the Santikos Theatres be showing animated movies,1
What is the movie schedule right now for movies around here,1
Where will The Blonde from Peking be playing,1
When can I see Salaam-e-Ishq: A Tribute To Love at B&B Theatres?,1
find a movie house with Ulterior Motive that is closest,1
Which movie theatre is playing The Good Guys and the Bad Guys?,1
What times will The Young Swordsman be showing at a local cinema?,1
Find the movie schedule.,1
what's the closest movie house showing Night in May,1
Please find me the nearest cinema playing Foreign Intrigue.,1
Where and when is This Is England playing,1
what time is The Rocketeer showing,1
what's the closest movie theatre that is playing films,1
find movies that are nearby,1
What movie theatre is playing Shed No Tears,1
Find the movie schedule for ArcLight Hollywood.,1
Can I get the newest listings for movies at Harkins Theatres,1
Find the movie schedule.,1
What time is Pussyfoot playing at Pacific Theatres?,1
Find the movie schedule for Cooper Foundation.,1
Tell me when Howling II: Your Sister Is a Werewolf is playing.,1
What time is Southern Theatres showing Ukraine Is Not a Brothel?,1
show the schedule of movie times,1
find Worldly Goods starting now at a movie house,1
What is Dear Old Girl Cooper Foundation,1
Which animated movies are playing today at KB Theatres?,1
What time are films showing in the neighborhood,1
What are some movies playing in the neighbourhood?,1
List movie times at General Cinema Corporation,1
Can you bring up the movie schedule for ArcLight Hollywood?,1
Is Live from Sturgis 2006 playing at four o'clock at the nearest cinema?,1
what movie theatre closest to me is playing animated movies and when,1
what animated movies are at Cobb Theatres,1
find movie times,1
Find the schedule for Idols of Clay at a movie house.,1
What are the movie schedules,1
show movie schedules,1
Is Rio Belongs to Us playing at the movie house closest to me,1
give me the movie times for Fox Theatres,1
When can I watch Prince Daewon at movie house?,1
find the nearest animated movies at a movie theatre,1
When is Sea of Fear being shown at the closest movie theatre?,1
What films are there playing at Cobb Theatres?,1
find Kebab Connection,1
I need a list of Mann Theatres films that are playing,1
find the nearest movie house showing Dangers of the Canadian Mounted,1
Does AMC Theatres have movie schedules out?,1
What are the movie times for animated movies nearby?,1
What film is playing nearby,1
what movie house is showing Sherlock Holmes and the Secret Weapon,1
What is the movie schedule looking like,1
What is the movie schedules for movies in the neighbourhood,1
Is And the Ship Sails On playing at Douglas Theatre Company 1 minute from now?,1
I'd like to see movie times please.,1
What is the closest movie theatre showing In Pursuit of Honor?,1
What are the movie times of films in the neighbourhood,1
"Is The Belles of St. Clements playing at Star Theatres in 8 minutes?
",1
Please provide me with movie schedules.,1
find a movie house closest with animated movies,1
I'd like to watch films at the closest movie theatre ,1
Check the movie schedule for Wanda Group,1
find Italy Has Awakened at a Goodrich Quality Theaters,1
What is the movie schedules at Consolidated Theatres,1
Whaere is Bloody Bloody Bible Camp playing in the cinema,1
Show me a movie schedule.,1
find a United Paramount Theatres and movie times at 4 A.M.,1
in the neighbourhood find movies,1
Show movie schedules for Douglas Theatre Company,1
What are the current showtimes for Love Fiction?,1
She me what movies are playing at 1 o'clock at the nearest movie theatre,1
Which films are playing in the neighbourhood?,1
I'm looking to watch Savage Grace at Showcase Cinemas at thirteen o'clock.,1
Which films are playing at the closest movie house?,1
Find the movie schedule for close by films.,1
Find movie times for B&B Theatres.,1
I want to see the movie schedule for KB Theatres.,1
Can you give me a list of films at Cinemark Theatres?,1
IS Anti-Semitism in the 21st Century: The Resurgence playing now,1
She me the movie schedule for animated movies at the place nearby,1
Where is the nearest movie house that is playing Sirivantha,1
what time can i see The Conflicts of Life,1
find films closest to a cinema,1
I'm looking for local movie schedules.,1
Show movie schedules with movies in the neighborhood,1
What are the movie times for Megaplex Theatres,1
Find movie times for close by movies.,1
Find me the movie times for the Alamo Drafthouse Cinema,1
Give me the movie schedule for the Great Escape Theatres,1
When is Game in the Sand playing at the movie house?,1
What time are the movie schedules,1
I'd like to see movie times at Santikos Theatres,1
show movie times,1
Show movie schedule and movies in the area,1
Are any films play at the Santikos Theatres,1
find movie times,1
Find movie schedules for Bow Tie Cinemas.,1
Find the movie schedules for animated movies nearby at 09:44 am.,1
what time is The World According to John Coltrane playing,1
What movie theatre is the closest that is playing Cheat You Fair: The Story of Maxwell Street right now,1
show movie schedules for animated movies playing close by now,1
Find films available at Cooper Foundation,1
in 1 hour and 1 minute find a cinema nearest for films,1
I want a list of films that are going to be shown in the neighborhood.,1
What are the local movie times,1
Which movies are playing at B&B Theatres at 2 pm?,1
find Manthra Mothiram at Century Theatres,1
what movie theatre is showing Titanic: The Legend Goes On,1
I need current movie schedules.,1
what animated movies are in the area,1
Where and when can I see The Image Makers,1
find a Cineplex Odeon Corporation showing movies,1
what films are showing around here,1
When is Twentynine Palms playing at Plitt Theatres?,1
is The Sleeping Beauty playing at 8 A.M.  at Cobb Theatres,1
When is Dead Birds playing?,1
What's the movie schedule for films in the neighbourhood,1
Give me the schedule for Getting There: Sweet 16 and Licensed to Drive,1
what time is Twin Peaks: Fire Walk with Me showing,1
What are the movie schedules for movies around here?,1
What time is Phil Ochs: There but for Fortune playing at the movie house,1
I'd like to watch Wish You Were Dead,1
Can I watch The Sound of War in thirteen minutes at the nearest cinema,1
What films are playing at Goodrich Quality Theaters,1
What are the movie times for movies in the area?,1
what is the movie schedule of animated movies in the area ,1
"What films and movie schedules are in the neighborhood
",1
What is the closest movie theatre that is playing Moment to Moment?,1
Can I see the movie schedules nineteen minutes from now?,1
showings for animated movies in the area ,1
What are the movies scheduled to play at General Cinema Corporation,1
Is The Man Who Won playing at 6 P.M.?,1
in the neighbourhood find movies starting in thirteen hours,1
What movie times are there at ArcLight Hollywood,1
List movie schedules at Showcase Cinemas,1
When is Cooper Foundation on the movie schedule?,1
When is Lake City playing at Dipson Theatres?,1
What is the movie schedules for the movies nearby playing 23 seconds from now,1
What is the nearest cinema showing Love in Mandya?,1
Find the movie times at Consolidated Theatres.,1
What time is Truth About Kerry playing at movie house,1
Can you let me know when Talk of the Devil is playing at the movie theatre?,1
When is The Pirate Fairy playing at AMC Theaters?,1
What are the movie times at General Cinema Corporation,1
Find the movie schedule for animated movies in the neighbourhood.,1
When is Sins of the Fathers playing?,1
find a movie theatre with Beware of Bachelors,1
Check the movie schedules.,1
Can you let me know the films that are on the movie schedules in the area at noon?,1
find a movie schedule,1
What time is A Man for Burning playing,1
Please show me the closest movie house playing Wild on the Beach in 1 minute.,1
what animated movies are playing at the closest movie house,1
What time does Lilacs in the Spring play at the closest movie house,1
whats the movie schedules for animated movies close by,1
show movies in United Paramount Theatres,1
Which films are playing close by?,1
find animated movies close by with a movie schedule,1
where is Ennarukil Nee Irunthal playing,1
What is the movie schedule for today?,1
what are the movies movie times nearby,1
Where can I find movie schedules,1
Is The Passion of Anna playing four seconds from now at the cinema,1
What time is 26 Years Diary showing in the movie house?,1
Find a movie schedule.,1
find a cinema nearest with Sulle Sathya,1
find Invisible Child at Southern Theatres,1
Give me the movie schedules for Neighborhood Cinema Group,1
give me a list showtimes for The Night of Taneyamagahara ,1
I need a movie schedule for nearby animated movies,1
show movie schedule for animated movies in the neighborhood,1
Where Can I watch Chaos and Desire?,1
what is the schedule for The Fox and the Child in cinema,1
When will the Blonde Ambition be playing,1
find a cinema closest with animated movies,1
List movie schedules for movies playing close by,1
show movie times,1
Can I get the movie schedules for Megaplex Theatres?,1
What movie theatre is playing The Missing Picture,1
Is Liberator playing at the IMAX Corporation at 11?,1
Which is the nearest cinema showing A Cooler Climate that starts now?,1
find Dickinson Theatres showing From Bondage to Freedom,1
find Plitt Theatres now showing Poverty and Nobility,1
Give me the current showtimes for Tarass Boulba.,1
Please find movie schedules,1
What time are movies showing at Megaplex Theatres,1
Where can I find Paranormal Activity 3 playing near me 1 hour from now,1
What films are there being played at Megaplex Theatres?,1
is Young Policemen In Love at the local movie theatre,1
I want to see movie schedules at Plitt Theatres.,1
Is The Right to Strike playing at Star Theatres,1
find Partners in Action at Dickinson Theatres,1
I'd like to see local movie times.,1
What time is A Battle of Wits starting?,1
show me the schedule of Letters from a Porcupine in Alamo Drafthouse Cinema,1
Please give me the movie schedules.,1
what's the closest movie house showing The Legend of Ben Hall,1
Find me the nearest cinema that have movies starting right now.,1
I'd like to watch movies at the nearest movie house,1
Find the movie schedule for animated movies in the area.,1
find Alamo Drafthouse Cinema with animated movies,1
Find the movie schedule for Dipson Theatres.,1
Can I get the newest movie schedule in the area  for animated movies?,1
Find the schedule for animated movies in the area.,1
What is the movie schedule at Loews Cineplex Entertainment,1
find a cinema nearest for films,1
What movies are currently playing at the Caribbean Cinemas,1
I'd like to watch films anywhere nearby,1
Where is the nearest cinema that has Southside 1-1000?,1
What are the movie schedules at Loews Cineplex Entertainment,1
What times will animated movies be showing nearby?,1
When are the movie schedules,1
Is The Missing Clerk playing,1
what's the nearest movie house showing Women Who Fall by the Wayside,1
What is the movie schedule for the B&B Theatres,1
Give me some info on when Hands Across the Border will be laying at the cinema.,1
Please check whether any animated movies will be running in the area around 04:34:15 PM.,1
What animated movies are playing at the Magic Johnson Theatres,1
What films are at the nearest movie theatre,1
What time is Sontha Ooru playing,1
Is The Divine Jetta at Marcus Corporation,1
What movies are playing in the neighborhood,1
When is The Naked Eye playing at the closest movie theatre,1
Find the schedule for for close by movies.,1
show me the movie schedule,1
Tell me the movie schedules,1
what's the nearest movie house showing films,1
What time can I watch Son of Rambow Tonight at Fox Theatres,1
Which movie house is playing Snow in the Desert today?,1
I want to know the films playing at the closest movie house.,1
Where the The Housemaid playing and when,1
Find the schedule for movies at Harkins Theatres.,1
Are any animated movies playing at Magic Johnson Theatres?,1
Is the film Goodrich Quality Theaters playing at 12:26 AM?,1
Which cinema is currently showing The Youngest Profession?,1
Where is the nearest movie house that is playing Sirivantha,1
Is Mentioned in Confidence at the cinema,1
Please tell me the movie times  ,1
What is the nearest movie theatre playing Kate y Leopold?,1
What cinema is playing The White Stadium?,1
Find movie schedules.,1
find Noon movie times at IMAX Corporation,1
what is the movie schedule for the Cooper Foundation,1
What time is The Face in the Moonlight showing?,1
find animated movies movie schedule in the neighborhood,1
What are the movie schedules for films in the area?,1
What are the morning movie schedules for movies in the neighborhood?,1
Recite the movie schedule.,1
Tell me what animated movies are being played at the closest movie house at 01:19:00 AM,1
Is The Love Guru playing ,1
find Now and Forever,1
Can I get the movie schedules  for Loews Cineplex in six hours seventeen minutes and eighteen seconds.,1
Can I watch Flower and Snake at movie house in one hour from now?,1
I'd like to know what movies are on the movie schedules nearby.,1
What time is The Lottery Man playing?,1
What is the movie schedule 1 second from now,1
What's the closest movie house that's showing animated movies?,1
What animated movies are playing at the closest cinema,1
What time is The Mourner playing at the movie house?,1
Is the start eim 23 hours twenty one minutes and one second from now for Morgan – A Suitable Case for Treatment at Santikos Theatres,1
Find the schedule for movie times.,1
I'd like to know the movie times for movies nearby me,1
Which movies are showing at Southern Theatres?,1
when is Red Shirts showing at Dickinson Theatres,1
Please check the movie schedule,1
Is Convoy Busters playing,1
"What time is Careful, He Might Hear You playing at the cinema",1
Find the movie schedules for Consolidated Theatres.,1
Find the schedule for Ghost World.,1
find movies around here with movie schedules,1
What is the nearest cinema playing Romance of the Limberlost,1
Can i get the showtimes for films at Dickinson Theatres?,1
What is the movie schedule near me?,1
"What time is Atlantis, terre engloutie playing?",1
show me the schedule of films in the neighbourhood,1
give me the movie times for movies showing in the neighborhood ,1
list movies  in the neighbourhood,1
Give me the movie times at Goodrich Quality Theaters.,1
Find the movies and movie times in the neighbourhood ,1
"what films are playing at the closest movie house ar
 elevenses",1
Please show me the films playing at Loews Cineplex Entertainment.,1
What's the closest cinema playing Chuckys Baby now?,1
Is Hollows Grove playing at any movie theatre at ten pm?,1
show me the movie schedule in the area near my home at seven AM for animated movies,1
Show me movie times,1
Find the movie times for films in the area.,1
find the closest movie theatre with films,1
What is the movie schedule for movies close by,1
Find the schedule for Central Airport at the closest movie theatre.,1
give me the movie schedules for Warren Theatres,1
which is the nearest movie house playing The Diary of Anne Frank,1
Show me the movie schedule for movies opening today close by,1
Can I see the movie schedules?,1
Find the movie schedules for Cineplex Odeon Corporation.,1
When will The Flower and the Angry Waves be showing?,1
Is I Was an American Spy playing at 11 a.m. at Southern Theatres,1
I'd like to know what films are scheduled at Alamo Drafthouse Cinema.,1
find movies at the nearest cinema,1
What movie times at Megaplex Theatres,1
Which cinema is playing Das Ende – Assault on Precinct 13?,1
Please inform me when I can see The Abdication at a movie theatre.,1
What time could I see A Mile in His Shoes?,1
What time does A King in New York play in Malco Theatres,1
Can i get the listings for the film at the nearest movie theatre?,1
Is Amco Entertainment showing Cień Caseya today?,1
I'd like to watch Broadway Nights at Megaplex Theatres,1
Find the movie schedule for Marcus Corporation.,1
find movie times,1
What are the movie times for Amco Entertainment,1
find movie schedules,1
I'd like to watch Demolition Man at 11:09 PM,1
What are the movie schedules,1
Find the nearest movie theatre that plays Sea Racketeers,1
What time is Irreconcilable Differences playing Regal Entertainment Group,1
She me movie schedules for the movies close by at sunset,1
Is Happy Ghost III at Caribbean Cinemas,1
show the movie schedules in the neighborhood for animated movies,1
what movie house is the closest playing animated movies,1
Find the movie schedule for Pacific Theatres.,1
Show me the movie schedules for movies playing around here today.,1
What cinema is the closest showing movies,1
Which cinema can I go to to see Lilly the Witch: The Dragon and the Magic Book?,1
will Dick Tracy e il gas misterioso start twenty one hours from now,1
find the closest starting now movie house with animated movies,1
Show me the closest movie house playing animated movies please.,1
Show movie times and movies in the area,1
Is Green Grass Widows playing at the cinema,1
Where and when is Douglas playing?,1
Where is Walt: The Man Behind the Myth playing,1
What time is Beat the Devil coming on at Mann Theatres,1
find movie times nearby for animated movies,1
find movie times,1
Can i get the showtimes for films close by?,1
Is The Little Irish Girl playing,1
Can I see the movie times for the Great Escape Theatres,1
Need the closest movie house playing The Flamingo Rising,1
What cinema is playing The Strongest Instinct now?,1
What time is Between Tears and Smiles playing,1
Show me the closest movie house that plays That Night in Rio ,1
Find the schedule for films at the Douglas Theatre Company.,1
