request,SearchScreeningEvent
Where can I see The Somme starting at 16:01:04?,1
What time is Bloody Twilight playing?,1
What time is Last Exit to Brooklyn playing at movie house?,1
I'd like to see showings for All the Way Home at Kerasotes Theatres.,1
what films are at the closest movie theatre ,1
What movies are scheduled in the neighbourhood?,1
give me the showtimes for Down Where The Buffalo Go at Amco Entertainment,1
What are the movie schedules for any animated movies playing in the neighbourhood?,1
Find movie schedules for ArcLight Hollywood.,1
What time is Phera playing,1
When does Of Stars and Men play?,1
Which movies are playing at AMC Theaters 1 second from now?,1
Find Fish Story ,1
Will you show me a schedule for movies around here?,1
What films are playing at 11 A.M. at Dickinson Theatres,1
Find the movie schedule.,1
What is the movie schedule for films in the neighbourhood,1
find movie schedules with animated movies close by,1
Where can I see No Time to Die?,1
where can i watch Key to the City,1
What movies are playing at the closest movie house?,1
Find the schedule for movie times for movies around here.,1
find animated movies around here,1
Show films at the nearest cinema,1
show the movie schedules,1
What are the animated movies in the neighbourhood  for the recent movie times,1
What is the movie schedule at the IMAX Corporation three minutes from now,1
When is For Lovers Only playing?,1
Is Love and Other Troubles playing,1
When is The Blue of Heaven playing?,1
find a movie theatre with Rogues and Romance that is nearest,1
Can you tell me the movie schedule for General Cinema Corporation?,1
What time is Do Sher playing,1
I need to know what theatre is playing A Happy Coersion,1
Find the schedule for films around here.,1
I need the movie Kids in Love at the movie house,1
what movies are at the nearest movie house,1
What time is Wild and Wooly playing,1
Find movie schedules.,1
What time is My Son Shall Be Armenian playing at Plitt Theatres,1
show the movie schedules at United Paramount Theatres,1
find close by movie schedule movies,1
Find me showtimes for How I Unleashed World War II.,1
What films are showing at Cineplex Odeon Corporation?,1
what are the movie schedules?,1
Where is the closest cinema playing Osmanthus Alley,1
What are the movie times for the movies in the neighbourhood,1
Does The Yacoubian Building start at 08:39 pm,1
When's Fools for Luck showing?,1
What time is Just Around the Corner playing,1
what animated movies are at the nearest movie house,1
Please tell me what the movie schedule looks like for the AMC Theatres in twenty one hours,1
What is the local movie schedule,1
Is the Wandering Detective: Black Wind in the Harbor playing at Cinemark Theatres,1
Please tell me the movie schedules,1
I want to go see The Trouble with Girls,1
Where is Boo to You Too! Winnie the Pooh playing,1
Is The Suicide Shop playing at Southern Theatres,1
What movies are showing at the nearest movie house?,1
What animated movies are showing in the area?,1
What are the movie schedules for Santikos Theatres?,1
what films are at Cinemark Theatres,1
What are the movie schedules,1
Find a movie schedule.,1
I want to see the local movie times,1
"when does Miss Sloane play at IMAX Corporation
",1
find a movie theatre showing The Tailor of Panama,1
I'd like a movie schedule for a close by movies,1
what animated movies are playing at Fox Theatres,1
find a movie house closest showing Operation: Kingdom,1
What films are playing at 1 PM at Showcase Cinemas,1
"Where can I watch Portrait of a Woman, Nude in 1 hour?",1
I want the film for nearest movie theatre,1
I'd like to watch Health Warning at the closest movie house,1
Is The Butcher Boy playing anywhere at supper time?,1
Which animated movies are playing at Fox Theatres?,1
I'd like to watch Heartbreak at Pacific Theatres at two pm,1
Find the movie schedule.,1
in the neighbourhood find movies,1
what time is The Bodyguard at Malco Theatres playing,1
find Mary Kom starting in one hour ,1
Find the movie schedule.,1
Find the closest movie house that plays animated movies,1
Is Storm Warning playing,1
What are the movie times at Landmark Theatres,1
is These Girls at the cinema,1
What time is Unholy Women playing?,1
Find the movie schedule at twelve AM.,1
Is Hercules and Xena: The Battle for Mount Olympus playing at the closest cinema,1
find Brandy in the Wilderness,1
what is the movie schedule for Cineplex Odeon Corporation,1
List movies at IMAX Corporation,1
Where can I see Travelling Light?,1
When can I see The Crew of the Dora,1
Find me the movie times for the Marcus Corporation,1
What time is The Bride Wore Boots playing,1
What time is Cabin Fever: Spring Fever playing,1
can i get the showtimes for films in the neighbourhood,1
Which movie theatre nearest me is showing animated movies starting now?,1
can i have the movie schedule for right now,1
What is the movie schedules at for Douglas Theatre Company at 0 p.m.?,1
Can i get the showtimes for films in the area.,1
Find me the movie times,1
Is Brother at United Paramount Theatres,1
List movie schedules,1
Give me the movie listings at the closest cinema please.,1
find the nearest movie house for The Mystery of Picasso,1
I would like to see a schedule for movies at the nearest movie house.,1
I want to see King of the River in the nearest movie theatre,1
Are there movies at Malco Theatres,1
find Warren Theatres films,1
find me the nearest movie theatre that's showing The Spell of the Yukon,1
Find the schedule for Chronicle of My Mother at the nearest cinema in 1 minute and 8 seconds.,1
What time is The Ladies Diplomat playing?,1
Is The Mystery of Betty Bonn playing at twelve A.M. at the nearest movie house?,1
find The Panic in Needle Park,1
Show me movie schedule,1
Show me movie times for two a.m. at any nearby movies.,1
What movies are playing at Warren Theatres?,1
what animated movies are showing in the neighborhood ,1
Find the movie schedules for Great Escape Theatres.,1
When is the next showing of Star Wars: The Clone Wars?,1
What is the movie times at Marcus Corporation,1
Need to see Mother Joan of the Angels in one second.,1
What animated movies are playing nearby right now?,1
is The Clowns at the nearest cinema ,1
What films are scheduled at the closest cinema?,1
Is Tomorrow at Seven being played at Douglas Theatre Company?,1
What are the movie schedules at the IMAX Corporation,1
find a cinema for The Tenderfoot nearest me,1
Show the movie schedule at Regal Entertainment Group,1
Give me the movie schedules for National Amusements.,1
What movies are at Malco Theatres,1
Show a movie schedule with Bow Tie Cinemas,1
What time is The Riders of the Whistling Skull playing at Magic Johnson Theatres,1
Where can I find the movie schedule?,1
Is Arthur 2 – On the Rocks playing at 20:44?,1
"What movies are playing at Dipson Theatres
",1
Find the movie schedule.,1
Show movie schedule at Amco Entertainment,1
Where is the closest cinema playing Good Night Good Morning,1
When is Girls Just Want to Have Fun playing at the movie house?,1
What animated movies are playing at Dipson Theatres?,1
Find the schedule for The Cup Winner at the closest movie house.,1
What are the movie schedule for the movies in the neighborhood,1
What movie schedules at Consolidated Theatres,1
What movies are scheduled at Plitt Theatres?,1
What animated movies are at the closest movie theatre,1
find a Loews Cineplex with films,1
What time is Rites of Spring playing at Marcus Corporation,1
List all the movies playing in the area now.,1
Showtimes for the films at Santikos Theatres,1
Find the schedule for Vanishing of the Bees at a movie house.,1
show me the schedule of movie Warning from Space closest to movie house,1
Show me the movie schedules for movies playing nearby.,1
Please tell me the movie schedules ,1
What movies are playing Dickinson Theatres,1
give me the Morning movie schedules,1
When is The Great Question playing at the closest movie house?,1
where can I watch Mabel’s Dramatic Career at twenty two o'clock,1
What movies are playing at the nearest movie house,1
in one hour find King of Hearts,1
in the neighbourhood find a movie schedule for animated movies,1
When is The Stain playing at Loews Cineplex?,1
Is The Angel of Vengeance – The Female Hamlet playing at the cinema at 6 am,1
What time do the movies play at Southern Theatres?,1
Where does The Return of the Whistler play at the Bow Tie Cinemas at 03:01:48 A.M.,1
Is Goodbye Mr. Chips showing twelve minutes from now,1
I'd like to watch The Wedding Ring at the movie theatre,1
What theater is showing From Paris with Love and when?,1
list movie times with meal,1
Is The Lady and the Highwayman playing at 7 A.M. at Dipson Theatres?,1
When will Hard Time Romance be showing at the cinema?,1
Is A Man Called Hero playing during brunch at the cinema,1
Can I go see Cash and Curry at a movie theatre?,1
What animated movies are at Dipson Theatres,1
show me the schedule of movie times in Dipson Theatres,1
I'm wondering if you can give me the movie times for films in the neighborhood.,1
FInd the movie times for films in the neighbourhood.,1
is Tomorrow at Dawn at Harkins Theatres,1
Find the movie schedule for ArcLight Hollywood.,1
Show me the movie schedule ,1
where is The Incite Mill playing,1
Find the movie schedule for films in the area.,1
show me movie times,1
What is the closest movie house playing House of the Dead 2,1
Where is the nearest cinema that is playing Pioneers of the West,1
What time is Socrates playing at the cinema?,1
Show me the movie times for what's playing now,1
are there any movies playing around here,1
Where can I watch Hank Williams: The Show He Never Gave?,1
Showtimes for Butterfly on a Wheel.,1
What movies are playing at the closest cinema,1
What time is 30 Days of Night playing?,1
Fine movie times for animated movies in the neighborhood.,1
Show me schedules to see A Film with Me in It.,1
movie schedule for animated movies in the neighborhood,1
Is A Charming Man playing at lunch time?,1
Can you give me the movie schedules for films close by?,1
What times is the 7 Faces of Dr. Lao showing at United Paramount Theatres,1
is Las aventuras de Zachary Beaver at Harkins Theatres,1
show me the schedule of Dead Snow,1
Find the schedule for movies at Plitt Theatres.,1
Give me showtimes for The Tenth Woman at the movie house.,1
What is the movie schedule,1
show me movie schedules,1
Is Unsettled Land playing at the movie theatre,1
Show me when Scandalous John is playing.,1
Is The Matinee Idol 06:30 cinema sold out?,1
where is The Yellow Star: The Persecution of the Jews in Europe 1933-45 playing,1
show animated movies in nearest movie theatre,1
"what time can i see Girls to Marry

",1
I'd like to see the current showtimes for His Kind of Woman,1
What is the nearest movie theatre playing Stray Cat Rock: Wild Jumbo in 7 seconds,1
What animated movies are playing in the neighbourhood and when?,1
Give me a list of films at AMC Theatres,1
find Un weekend da bamboccioni,1
Can I get the movie schedules for Marcus Corporation.,1
What are the Mann Theatres showtimes for Secret Sunshine,1
What are the timings for Starship Troopers 2?,1
What movies are playing at Regal Entertainment Group,1
what time is The Clutching Hand playing at Amco Entertainment,1
Can i get the movie schedule  for films nearby.,1
Where is All Night Long 3 playing 1 hour from now,1
show movie times now,1
Find time for movie times now,1
What time will the closest movie house be playing Mark Shoots First,1
list animated movies at the nearest cinema,1
I'd like to watch All on the Red at 9 o'clock,1
find the movie schedules,1
Can I get the movie schedules for Southern Theatres at around 15:02,1
Can I get the movie times for in the neighbourhood movies,1
what films are playing at KB Theatres,1
Find the closest cinema playing The St. Francisville Experiment.,1
I want to see a list of local movie times.,1
find animated movies close by with a movie schedule,1
What films are playing at Great Escape Theatres,1
SHOW movie schedule,1
What is the closest cinema today playing animated movies?,1
What are the movie times one second from now at the Alamo Drafthouse Cinema,1
I need to see the movie schedules,1
Find the schedule for nearby animated movies.,1
what's Southern Theatres movie schedule,1
What movies can I see in the area?,1
Find the movie schedule at Malco Theatres.,1
Is Holy Matrimony playing at National Amusements?,1
Find the schedule for Brick.,1
what films are showing in the neighborhood ,1
Find movie schedules for movies in the area.,1
find Belle of the Yukon,1
Fine movie times.,1
find Kerasotes Theatres movie schedules,1
Where and at what time can I see Paragraphe 78,1
Find time for Enkitta Mothathe at Pacific Theatres,1
What time is Holiday Heart showing at the movie house,1
What are the movie schedules,1
Give me the schedule for animated movies at the nearest cinema,1
Show me the movie times for Caribbean Cinemas in 1 second .,1
where can i watch Wartime Romance in the morning,1
I need the movie schedules for Century Theatres,1
Can i get the showtimes for movies around here?,1
Give me showtimes for films in the neighbourhood.,1
where's the nearest movie house playing No Trains No Planes,1
whats the movie schedules for General Cinema Corporation,1
What are the movie times for animated movies playing close by,1
Is Flow: For Love of Water playing at Southern Theatres at 2 am,1
can I get the movie schedules for Goodrich Quality Theaters,1
List films at the nearest movie house,1
Show me the nearest movie house showing He Won a Ranch,1
Please find the schedule for Jappeloup at Bow Tie Cinemas.,1
What time is Cold Prey 3 playing at cinema,1
I'm wondering when I can see Hurry Sundown.,1
find The World Is Ours at a movie theatre,1
What movie house is playing Something for the Birds,1
show the animated movies playing at Consolidated Theatres,1
what animated movies are showing at Star Theatres,1
I'd like to see movie schedules for Kerasotes Theatres,1
For the Star Theatres is The Belles of St. Clements playing in 8 minutes ,1
What is the nearest movie house playing The Miracle Rider,1
Find me the movie schedule for Great Escape Theatres,1
what are the movie times for Consolidated Theatres,1
find the movie schedule,1
Find the schedule for for films at Star Theatres.,1
What films are playing at Marcus Corporation?,1
What is the 7 A.M. movie schedules at Amco Entertainment,1
what movies are showing in the neighborhood ,1
what films are at Kerasotes Theatres ,1
Find the movie schedules at the Neighborhood Cinema Group,1
When is Beneath the Harvest Sky playing?,1
Show me the movie times for films nearby.,1
Show me animated movies that are playig at Great Escape Theatres,1
find Endless Horizons,1
Where is the nearest cinema that is playing The Kid Brother,1
"When is Have Sword, Will Travel playing at the closest movie theatre?",1
What time are movies showing around here,1
Can you tell me the movies that are going to be scheduled at the closest movie house?,1
what's the closest movie theatre showing Harbour Beat,1
find films at Magic Johnson Theatres,1
what films are showing at Cooper Foundation,1
Find the schedule for movies at Southern Theatres.,1
i want to watch Mister Cool,1
Find the schedule for movies at Star Theatres.,1
What films and movie schedule are in the area,1
what animated movies are at Fox Theatres,1
Find the schedule for films in the neighborhood.,1
Whats the closest cinema that shows movies at 12 A.M.,1
What films are going to be shown at the nearest movie house?,1
Is Race Gurram playing,1
Is Blood Is Not Fresh Water playing at this movie theatre at 2 AM?,1
Find me The Twinkler playing at National Amusements in 2 minutes,1
Find the movie schedule for animated movies around here.,1
what animated movies are in the neighbourhood,1
What are movie times for animated movies close by?,1
find Kerasotes Theatres with movie times,1
find movie schedules for AMC Theaters,1
Can you let me know when Troopers Three is scheduled?,1
find films in 12 hours at the nearest movie theatre,1
Find the movie schedule for 20:45:24.,1
What cinema is showing Ice Station Zebra at 07:25 P.M.?,1
find a movie schedule,1
Can i get the movie times for Fox Theatres?,1
find animated movies at Amco Entertainment,1
find movie times,1
Show the movie schedule,1
List films at Pacific Theatres,1
show movie times in North American Cinemas,1
What movies are showing at the Showcase Cinemas,1
Find me the movie schedules at Fox Theatres,1
What animated movies are at Pacific Theatres,1
Find time for College Rock Stars at any movie theatre,1
Where is the closest cinema that is playing The Honeymoon Killers,1
"Is The Happy Hooker Goes Hollywood at the movie house nearest me
",1
What films are showing at the closest movie theatre?,1
Where is The Penthouse playing,1
where is My Song Goes Forth playing,1
"Is Love, Marilyn playing",1
Where is the nearest movie house that is showing The Kingfisher Caper?,1
What movies are at North American Cinemas,1
what movies are playing at Warren Theatres,1
what movies are close by,1
Show the nearest movie house with The Expendables starting 1 minute from now,1
find movies in the neighbourhood with movie times,1
what films are at the nearest cinema,1
what time can i see Mojave Phone Booth,1
"Please shoe me the movie schedule for today.
",1
Is A Master of Craft playing at Wanda Group,1
Find the movie schedules for nearby movies.,1
Find time for The Thirty Nine Steps ,1
What is the movie schedules for films in the neighborhood,1
find a movie house with Hollow Reed,1
Let me know the movie times for films in the area.,1
What time is The Message playing at Loews Cineplex?,1
Fine movie schedules for Speakeasy Theaters.,1
what animated movies are showing nearby,1
Can I get the showtimes for The Kitchen Toto at Cineplex Odeon Corporation.,1
What time around here can I fins animated movies,1
does Red e Toby nemiciamici start thirteen hours from now,1
What is on the movie schedule for four AM at Landmark Theatres,1
What time is cinema playing The Village Priest?,1
Show me the movie schedule for Loews Cineplex.,1
List movie times playing animated movies nearby,1
find Santikos Theatres showing animated movies,1
Where is the nearest movie theatre that is playing The King Maker,1
Can i get the showtimes for Man in Blues?,1
I'd like the movie schedules nearby me for animated movies,1
Advise me on the movie schedule of films that will be playing at 07:31:32 pm at a place close by.,1
What time will The Age of Success be showing?,1
What Pacific Theatres are playing animated movies,1
find the nearest movies at a movie theatre,1
Show me the animated movies starting at 10:56:18 a.m. at the nearest movie house,1
What animated movies are showing at Loews Cineplex,1
Find the schedule for Fear Chamber.,1
What films are showing at Kerasotes Theatres,1
what movies are playing in the neighborhood ,1
What animated movies are playing at IMAX Corporation?,1
What time is See Grace Fly playing at Cineplex Odeon Corporation,1
Show movie schedules for Marcus Corporation,1
Can I get the showtimes for Fit for a King?,1
find a movie house for 07:52 showing Ganges: River to Heaven,1
Can you tell me the movie times for Alamo Drafthouse Cinema,1
what films are on the movie schedule around here ,1
Can you give me the movie schedule for Amco Entertainment?,1
What time is The Corner playing,1
"During tea time, what animated movies will be screening at the closest movie house?",1
Where can I see Young Goethe in Love?,1
Find movie schedules.,1
find Chained Heat,1
What time is The Secretary playing at the movie theatre?,1
what time is Dark World showing at Consolidated Theatres,1
What is the nearest movie house playing George Washington Slept Here,1
Which animated movies are being screened at Marcus Corporation?,1
What are the showtimes for Boy of Mine,1
what time is The Eddy Duchin Story playing,1
Show me the closest movie house playing An Unfinished Life at eight pm.,1
can I get the showings for films at the nearest cinema in 1 minute ,1
What are the showtimes for Beware! The Blob at Plitt Theatres?,1
What are the movie times for the Caribbean Cinemas?,1
Give me the showtimes for Sign of the Anchor.,1
Where is The Man with a Cross playing,1
Find the schedule for Salt of the Black Earth at the closest movie house.,1
When will The Boys Next Door be playing at the nearest  movie house,1
is Tarzan of the Apes playing at Cobb Theatres,1
I want to watch Looney Tunes Platinum Collection: Volume 1 at a movie theatre,1
Show me Dombey and Son movies.,1
What are the movie schedules for animated movies close by,1
Can I get the showtimes for films at the closest movie house.,1
tell me the movie schedule,1
what's the nearest cinema showing The Death of Stalinism in Bohemia 1 second from now,1
I want to know what movies are showing at the nearest movie house.,1
Find the schedule for The Nightmare six hours from now at the nearest cinema.,1
find The Bride,1
find movie schedules,1
Where is Priorities on Parade playing,1
What Howards End cinema is near?,1
find the closest films at a movie house,1
What time is Summer School playing?,1
Find the movie schedules for films in the area.,1
show movie times at Cinemark Theatres,1
Can you let me know where I can watch The Nest?,1
Tell me the movie schedules for Mann Theatres,1
Find the schedule for films at the closest movie house.,1
I'd like to watch movies at KB Theatres,1
Where is the nearest movie theatre that is playing Honeysuckle Rose,1
Give me a list of movie times for films in the area.,1
What time is Showcase Cinemas playing Straight Is the Way,1
show me the schedule of movie Shadow of a Woman,1
What time is The Mailman playing,1
what is the movie schedules for movies in the area ,1
What time is Soul Surfer playing,1
find the closest movie theatre for films,1
find The Swindlers at the closest movie house,1
Find movie times.,1
When is Janeane from Des Moines playing at the nearest movie theatre?,1
Is this film going to be at Malco Theatres?,1
what's the closest cinema showing animated movies,1
show me movie times at my local theater.,1
What is the nearest cinema playing Patiala House,1
What is the Wanda Group movie schedules ,1
is One Night Surprise at the cinema,1
What time does Kraken: Tentacles of the Deep play,1
Where is the closest cinema that features animated movies,1
I'd like to watch The Holy Office at Cooper Foundation,1
what are the movietimes for films in the neighbourhood,1
what film to see at ArcLight Hollywood,1
Which films are playing at Consolidated Theatres?,1
Is The Mystical Adventures of Billy Owens playing at the closest movie house,1
"I'd like to watch movies around here, can I see the movie schedules",1
What are the movie schedules for movies showing in the neighbourhood?,1
Find a movie schedule for 12 hours from now.,1
Find movie times for films in the area.,1
Which cinema is showing A Dedicated Life starting at eleven PM,1
What's today's movie schedule,1
Find movie schedules.,1
Find movie schedules for movies around here at nineteen o'clock.,1
Give me the local movie times.,1
movie schedule at Cinemark Theatres,1
show me movie times for Southern Theatres,1
What films are playing now at the General Cinema Corporation,1
Can I get showtimes for films in the neighborhood.,1
Find the schedule for Rare Birds at the nearest movie theatre at Noon.,1
What movies are playing at Mann Theatres,1
what time is The Challenge showing at the local movie house,1
Find movie schedules for nearby films.,1
show movie schedule in the neighbourhood films at five hours from now,1
What is the movie schedule for General Cinema Corporation?,1
find a nearby movie schedules for movies,1
Show me movie times  at Harkins Theatres.,1
show nearest movie theatre to watch Black Jesus,1
What movies are playing at AMC Theatres?,1
When is That Forward Center Died at Dawn playing at the closest cinema?,1
Please give me the movie schedule for Pacific Theatres,1
Show me movie schedule for animated movie around here at eleven a.m.,1
Please give me information on when Prisoner of Zenda will be shown.,1
find Mysterious Castles of Clay,1
Show the movie schedule and movies around here,1
Where is the closest movie theatre that is playing movies now,1
Whens the next showing of The Game of Their Lives,1
what's the closest movie house showing The Hard Way,1
"What cinema is playing Great Guy
",1
Find movie times for close by films.,1
Where is My Dearest Enemy playing,1
Find the schedule for Without Witness twenty two hours from now.,1
movie schedules for Neighborhood Cinema Group,1
What is the movie times for General Cinema Corporation,1
What Are the showings for The Natural History of Parking Lots movie house,1
What is the movie schedule at Cineplex Odeon Corporation 12 hours from now,1
where is The Country Bears playing,1
is Ce cher intrus at IMAX Corporation,1
What time is Trouble Every Day playing,1
What are the movie times?,1
I want to see Dead Calm at the closest cinema,1
What time is the closet cinema playing movies the closest,1
What time is Thick as Thieves playing at Santikos Theatres?,1
When is Harassed being played at Plitt Theatres?,1
What animated movies are playing at IMAX Corporation,1
Where can I get movie schedule,1
When can I go see The Untold Story?,1
Find me the showtimes for Until Death at the nearest movie house.,1
What is the AMC Theaters movie schedule?,1
When is The Sea of Grass playing at the movie theatre,1
Can i get the movie schedule for Megaplex Theatres.,1
What films are showing at three o'clock at the Neighborhood Cinema Group?,1
in the neighborhood find movie times for movies,1
Find the schedule for Wenn Lucy springt now at a movie theatre.,1
Are there any films around here,1
Is Jack the Ripper playing in one hour at the nearest movie house?,1
when can i see We and Our Mountains,1
i want to watch The Shamrock Handicap right now,1
Is Cradle Robbers playing at the nearest movie theatre,1
